factor,max_points,weight_pct,description,derivation_source,scoring_tiers
area_type,35,35%,Location neighborhood classification - strongest predictor of daily cup performance,"Correlation analysis: university_tourist=660cups vs residential=139cups across 8 stores","university_tourist=35; commercial_transit_hub=30; tourist_ethnic_enclave=26; financial_office=20; residential_mixed=10; residential=5"
subway_access,20,20%,Number of subway lines within walking distance - amplifies foot traffic,"All stores: subway amplifies good locations but cannot save bad ones (15th&3rd: 8 lines but 139 cups)","8+ lines=20; 6-7=17; 4-5=14; 2-3=10; 1=6; 0=0"
weekend_resilience,15,15%,Balance of weekday vs weekend traffic - measures revenue sustainability,"8th&Broadway (55% weekday) outperforms 100 Maiden (72% weekday) due to weekend tourist traffic","<=55% weekday=15; 56-60%=12; 61-65%=9; 66-70%=6; 71-75%=3; >75%=0"
cannibalization,-15,15%,Proximity penalty for distance to nearest existing Luckin store,"100 Maiden Ln (273cups) vs 102 Fulton (417cups) only 0.2mi apart shows cannibalization impact","<0.15mi=-15; 0.15-0.25mi=-12; 0.25-0.35mi=-8; 0.35-0.50mi=-4; >0.50mi=0"
rent_value,15,15%,Monthly rent efficiency relative to budget - lower rent at same quality scores higher,"Budget constraint: $20K/month. Breakeven at 290 cups/day. Lower rent = faster breakeven","<=12K=15; 12-14K=13; 14-16K=10; 16-18K=7; 18-20K=4; >20K=0"
